{
  "candidates": [
    {
      "apiUrl": "https://api.github.com/repos/AIDotNet/koala-ai",
      "archived": false,
      "defaultBranch": "master",
      "diskUsageKiB": 17540,
      "fork": false,
      "fullName": "AIDotNet/koala-ai",
      "instructionEvidence": [
        {
          "blobSha": "cdfcd64a7ee7070cb135f550a39e24c93789b0e7",
          "format": "cursor",
          "metadataUrl": "https://api.github.com/repos/AIDotNet/koala-ai/git/trees/463e686dd985679862c43bc837facac9cd6b44ff",
          "path": ".cursor/rules/ui.mdc"
        }
      ],
      "license": {
        "metadataUrl": "https://api.github.com/repos/AIDotNet/koala-ai",
        "spdxId": "Apache-2.0"
      },
      "monorepoEvidencePaths": [],
      "pinnedCommitSha": "153a2126818451892e2f77d60ac0893065099aa6",
      "pinnedTreeSha": "463e686dd985679862c43bc837facac9cd6b44ff",
      "primaryLanguage": "C#",
      "publicSourceEvidence": {
        "basis": "public-github-repository",
        "observedAt": "2026-08-09T01:01:51.332Z",
        "url": "https://github.com/AIDotNet/koala-ai"
      },
      "pushedAt": "2025-05-21T07:07:48Z",
      "repositoryId": "764009599",
      "repositoryUrl": "https://github.com/AIDotNet/koala-ai",
      "strata": ["cursor"],
      "traits": {
        "monorepository": false,
        "multipleInstructionFormats": false
      }
    },
    {
      "apiUrl": "https://api.github.com/repos/akamai/terraform-provider-akamai",
      "archived": false,
      "defaultBranch": "master",
      "diskUsageKiB": 50384,
      "fork": false,
      "fullName": "akamai/terraform-provider-akamai",
      "instructionEvidence": [
        {
          "blobSha": "d04f19e51347a7e6193a06064d2e40f176e76f55",
          "format": "copilot",
          "metadataUrl": "https://api.github.com/repos/akamai/terraform-provider-akamai/git/trees/890769d4ac2f52c8a9d46cc038039d3c9c24b5d5",
          "path": ".github/copilot-instructions.md"
        }
      ],
      "license": {
        "metadataUrl": "https://api.github.com/repos/akamai/terraform-provider-akamai",
        "spdxId": "MPL-2.0"
      },
      "monorepoEvidencePaths": [],
      "pinnedCommitSha": "6cae22fa6124f74ba6593aa41478fc93462d420b",
      "pinnedTreeSha": "890769d4ac2f52c8a9d46cc038039d3c9c24b5d5",
      "primaryLanguage": "Go",
      "publicSourceEvidence": {
        "basis": "public-github-repository",
        "observedAt": "2026-08-09T01:01:51.332Z",
        "url": "https://github.com/akamai/terraform-provider-akamai"
      },
      "pushedAt": "2026-07-29T09:39:38Z",
      "repositoryId": "190660950",
      "repositoryUrl": "https://github.com/akamai/terraform-provider-akamai",
      "strata": ["copilot"],
      "traits": {
        "monorepository": false,
        "multipleInstructionFormats": false
      }
    },
    {
      "apiUrl": "https://api.github.com/repos/Alfanous-team/alfanous",
      "archived": false,
      "defaultBranch": "main",
      "diskUsageKiB": 223242,
      "fork": false,
      "fullName": "Alfanous-team/alfanous",
      "instructionEvidence": [
        {
          "blobSha": "56b33fdd1e4886adf8caf40282e31cadd6b0674d",
          "format": "copilot",
          "metadataUrl": "https://api.github.com/repos/Alfanous-team/alfanous/git/trees/1dc74f3c83664975166a9e117c711b4f00aebd19",
          "path": ".github/copilot-instructions.md"
        }
      ],
      "license": {
        "metadataUrl": "https://api.github.com/repos/Alfanous-team/alfanous",
        "spdxId": "LGPL-3.0"
      },
      "monorepoEvidencePaths": [],
      "pinnedCommitSha": "c2a7cfd4645194de079bbfe8e4f0bc18c7cde2db",
      "pinnedTreeSha": "1dc74f3c83664975166a9e117c711b4f00aebd19",
      "primaryLanguage": "Python",
      "publicSourceEvidence": {
        "basis": "public-github-repository",
        "observedAt": "2026-08-09T01:01:51.332Z",
        "url": "https://github.com/Alfanous-team/alfanous"
      },
      "pushedAt": "2026-06-14T00:57:27Z",
      "repositoryId": "4617289",
      "repositoryUrl": "https://github.com/Alfanous-team/alfanous",
      "strata": ["copilot"],
      "traits": {
        "monorepository": false,
        "multipleInstructionFormats": false
      }
    },
    {
      "apiUrl": "https://api.github.com/repos/alibaba/hooks",
      "archived": false,
      "defaultBranch": "master",
      "diskUsageKiB": 13521,
      "fork": false,
      "fullName": "alibaba/hooks",
      "instructionEvidence": [
        {
          "blobSha": "a55997b003764786768ff2e4dca311372ae4ff61",
          "format": "agents-md",
          "metadataUrl": "https://api.github.com/repos/alibaba/hooks/git/trees/93c3561ac1d29a7dc1e6a3cf57495454fcf7f870",
          "path": "AGENTS.md"
        },
        {
          "blobSha": "43c994c2d3617f947bcb5adf1933e21dabe46bb5",
          "format": "claude",
          "metadataUrl": "https://api.github.com/repos/alibaba/hooks/git/trees/93c3561ac1d29a7dc1e6a3cf57495454fcf7f870",
          "path": "CLAUDE.md"
        },
        {
          "blobSha": "7b5e3a242854a977ef7724d4d5d0f2686ea72b9e",
          "format": "cursor",
          "metadataUrl": "https://api.github.com/repos/alibaba/hooks/git/trees/93c3561ac1d29a7dc1e6a3cf57495454fcf7f870",
          "path": ".cursor/rules/demo.mdc"
        },
        {
          "blobSha": "a6d7475c13b1ce0181e542316d8e1f677e094b77",
          "format": "cursor",
          "metadataUrl": "https://api.github.com/repos/alibaba/hooks/git/trees/93c3561ac1d29a7dc1e6a3cf57495454fcf7f870",
          "path": ".cursor/rules/docs.mdc"
        },
        {
          "blobSha": "ef285a10ed92dbc8c64d8b4dea0b8b980422c0ff",
          "format": "cursor",
          "metadataUrl": "https://api.github.com/repos/alibaba/hooks/git/trees/93c3561ac1d29a7dc1e6a3cf57495454fcf7f870",
          "path": ".cursor/rules/git.mdc"
        },
        {
          "blobSha": "deb9febac74e5df8e842287c178ab05ffa17d742",
          "format": "cursor",
          "metadataUrl": "https://api.github.com/repos/alibaba/hooks/git/trees/93c3561ac1d29a7dc1e6a3cf57495454fcf7f870",
          "path": ".cursor/rules/project.mdc"
        },
        {
          "blobSha": "f75012f8b6745097e5db973b59404ed7550fb6b0",
          "format": "cursor",
          "metadataUrl": "https://api.github.com/repos/alibaba/hooks/git/trees/93c3561ac1d29a7dc1e6a3cf57495454fcf7f870",
          "path": ".cursor/rules/testing.mdc"
        },
        {
          "blobSha": "1ee44e0d679c35369acf19148c851044e990a5c2",
          "format": "cursor",
          "metadataUrl": "https://api.github.com/repos/alibaba/hooks/git/trees/93c3561ac1d29a7dc1e6a3cf57495454fcf7f870",
          "path": ".cursor/rules/typescript.mdc"
        }
      ],
      "license": {
        "metadataUrl": "https://api.github.com/repos/alibaba/hooks",
        "spdxId": "MIT"
      },
      "monorepoEvidencePaths": ["pnpm-workspace.yaml"],
      "pinnedCommitSha": "bb42f8f53d2d2f366e2f0f3a58b0b5492fbd6cb6",
      "pinnedTreeSha": "93c3561ac1d29a7dc1e6a3cf57495454fcf7f870",
      "primaryLanguage": "TypeScript",
      "publicSourceEvidence": {
        "basis": "public-github-repository",
        "observedAt": "2026-08-09T01:01:51.332Z",
        "url": "https://github.com/alibaba/hooks"
      },
      "pushedAt": "2026-08-05T14:59:11Z",
      "repositoryId": "194027578",
      "repositoryUrl": "https://github.com/alibaba/hooks",
      "strata": ["agents-md", "claude", "cursor"],
      "traits": {
        "monorepository": true,
        "multipleInstructionFormats": true
      }
    },
    {
      "apiUrl": "https://api.github.com/repos/ArisGuimera/MobiAI-Core",
      "archived": false,
      "defaultBranch": "main",
      "diskUsageKiB": 5399,
      "fork": false,
      "fullName": "ArisGuimera/MobiAI-Core",
      "instructionEvidence": [
        {
          "blobSha": "ceb2b988dc8aeca264a49eab26ef39e636508c84",
          "format": "agents-md",
          "metadataUrl": "https://api.github.com/repos/ArisGuimera/MobiAI-Core/git/trees/c54f7d287e179e04f4a286422b59133d60780c8f",
          "path": "AGENTS.md"
        },
        {
          "blobSha": "33e126779bc952687521c0e386186a4fd156ea8c",
          "format": "claude",
          "metadataUrl": "https://api.github.com/repos/ArisGuimera/MobiAI-Core/git/trees/c54f7d287e179e04f4a286422b59133d60780c8f",
          "path": "CLAUDE.md"
        },
        {
          "blobSha": "38d607aeee8e5935143b1cb52011e54634ae08a6",
          "format": "gemini",
          "metadataUrl": "https://api.github.com/repos/ArisGuimera/MobiAI-Core/git/trees/c54f7d287e179e04f4a286422b59133d60780c8f",
          "path": "GEMINI.md"
        }
      ],
      "license": {
        "metadataUrl": "https://api.github.com/repos/ArisGuimera/MobiAI-Core",
        "spdxId": "MIT"
      },
      "monorepoEvidencePaths": [],
      "pinnedCommitSha": "8d56bee8c669175bdf595d5f068337183ff9c506",
      "pinnedTreeSha": "c54f7d287e179e04f4a286422b59133d60780c8f",
      "primaryLanguage": "Go",
      "publicSourceEvidence": {
        "basis": "public-github-repository",
        "observedAt": "2026-08-09T01:01:51.332Z",
        "url": "https://github.com/ArisGuimera/MobiAI-Core"
      },
      "pushedAt": "2026-08-03T07:14:57Z",
      "repositoryId": "1198521301",
      "repositoryUrl": "https://github.com/ArisGuimera/MobiAI-Core",
      "strata": ["agents-md", "claude", "gemini"],
      "traits": {
        "monorepository": false,
        "multipleInstructionFormats": true
      }
    },
    {
      "apiUrl": "https://api.github.com/repos/AzureAD/microsoft-authentication-library-common-for-objc",
      "archived": false,
      "defaultBranch": "dev",
      "diskUsageKiB": 20042,
      "fork": false,
      "fullName": "AzureAD/microsoft-authentication-library-common-for-objc",
      "instructionEvidence": [
        {
          "blobSha": "95e99961ac3755589f38750002b53b1a0d02b885",
          "format": "agents-md",